,id,user_name,tweet_date,tweet_text,punc_text,scores,compound,sentiment,sentiment_bin,vaccine
956,1.34036e+18,Colleen S. Kraft,19-12-2020 18:13,"""I think there must be something wrong with me, Linus. Christmas is coming, but I'm not happy. I don't feel the way… https://t.co/NtxGYv1ULq",I think there must be something wrong with me Linus Christmas is coming but Im not happy I dont feel the way,"{'neg': 0.251, 'neu': 0.749, 'pos': 0.0, 'compound': -0.7225}",-0.7225,negative,-1,[]
957,1.34036e+18,Joydeep Phukan,19-12-2020 18:03,@NYTHealth So much for equity and equitable distribution of the vaccine all over the world. Seems people in the dev… https://t.co/xGSxetxHWq,NYTHealth So much for equity and equitable distribution of the vaccine all over the world Seems people in the dev,"{'neg': 0.0, 'neu': 1.0, 'pos': 0.0, 'compound': 0.0}",0.0,neuteral,0,[]
958,1.34036e+18,Marc Siegel MD,19-12-2020 17:58,COVID vaccine distribution is complicated even if we follow the science #CovidVaccine #Moderna #PfizerBioNTech… https://t.co/CtuFbuFaSt,COVID vaccine distribution is complicated even if we follow the science CovidVaccine Moderna PfizerBioNTech,"{'neg': 0.0, 'neu': 1.0, 'pos': 0.0, 'compound': 0.0}",0.0,neuteral,0,"['pfizer', 'moderna']"
959,1.34035e+18,"John Giudicessi MD, PhD",19-12-2020 17:44,Big thanks to scientific/clinical teams at #PfizerBioNTech for this incredible feat and ⁦@MayoClinic⁩ for prioritiz… https://t.co/ltCXPOWxeN,Big thanks to scientificclinical teams at PfizerBioNTech for this incredible feat and MayoClinic for prioritiz,"{'neg': 0.0, 'neu': 0.828, 'pos': 0.172, 'compound': 0.4404}",0.4404,positive,1,['pfizer']
960,1.34035e+18,Masis der Parthogh,19-12-2020 17:40,#Cyprus gets cold storage for #PfizerBioNTech #vaccine https://t.co/9E7pJwJRLh,Cyprus gets cold storage for PfizerBioNTech vaccine,"{'neg': 0.0, 'neu': 1.0, 'pos': 0.0, 'compound': 0.0}",0.0,neuteral,0,['pfizer']
961,1.34035e+18,🇪🇺 Dr John 🏳️‍🌈 #BLM+N⭕️S 😷,19-12-2020 17:37,"@JustinSandefur Refusing #SputnikV doesn’t make you #antivax, to be honest. Development was rushed &amp; a phase 3 test… https://t.co/t7dtCCb52g",JustinSandefur Refusing SputnikV doesnt make you antivax to be honest Development was rushed amp a phase 3 test,"{'neg': 0.135, 'neu': 0.7, 'pos': 0.165, 'compound': 0.1531}",0.1531,positive,1,['sputnik']
962,1.34035e+18,drLogo,19-12-2020 17:20,"Vaccine side effect update, 48 hrs. My arm is not very sore, but the deltoid at the injection site is swollen.  I w… https://t.co/iKJhEPaCWE",Vaccine side effect update 48 hrs My arm is not very sore but the deltoid at the injection site is swollen I w,"{'neg': 0.0, 'neu': 0.923, 'pos': 0.077, 'compound': 0.1688}",0.1688,positive,1,[]
963,1.34035e+18,Financial Mirror,19-12-2020 17:15,"#Cyprus took delivery Saturday of 2 medical freezers from 
@PHCbiomed that will store the first batch of… https://t.co/K5sr00Qg3Z",Cyprus took delivery Saturday of 2 medical freezers from PHCbiomed that will store the first batch of,"{'neg': 0.068, 'neu': 0.932, 'pos': 0.0, 'compound': -0.0258}",-0.0258,negative,-1,[]
964,1.34034e+18,Arête News 🌍,19-12-2020 17:12,.@Swissmedic_ says its approval of #PfizerBioNTech's shot on Saturday is 'the world’s first authorization in the or… https://t.co/DrrNryK5je,Swissmedic_ says its approval of PfizerBioNTechs shot on Saturday is the worlds first authorization in the or,"{'neg': 0.0, 'neu': 0.838, 'pos': 0.162, 'compound': 0.4767}",0.4767,positive,1,['pfizer']
965,1.34034e+18,🏳️‍🌈🇪🇺🇬🇧,19-12-2020 17:04,Very relevant 🤣😂🤣😂🤣🤣 #Pfizer #Pfizervaccine #PfizerBioNTech https://t.co/MOImBrSYvm,Very relevant Pfizer Pfizervaccine PfizerBioNTech,"{'neg': 0.0, 'neu': 1.0, 'pos': 0.0, 'compound': 0.0}",0.0,neuteral,0,['pfizer']
966,1.34034e+18,Dr.Krutika Kuppalli,19-12-2020 16:45,Watching the #ACIP meeting on the @moderna_tx #CovidVaccine just like last week with the #PfizerBioNTech #vaccine.… https://t.co/c7z9b3Boom,Watching the ACIP meeting on the moderna_tx CovidVaccine just like last week with the PfizerBioNTech vaccine,"{'neg': 0.0, 'neu': 0.857, 'pos': 0.143, 'compound': 0.3612}",0.3612,positive,1,"['pfizer', 'moderna']"
967,1.34034e+18,Roberta Ann👠🇺🇲,19-12-2020 16:39,The media deliberately down played or ignored the Russian #coronavirus vaccine. Its now all about #Pfizer… https://t.co/hxoGhLzwG7,The media deliberately down played or ignored the Russian coronavirus vaccine Its now all about Pfizer,"{'neg': 0.123, 'neu': 0.749, 'pos': 0.128, 'compound': 0.0258}",0.0258,positive,1,['pfizer']
968,1.34033e+18,Max ‘New beginnings’ Headroom 🛩,19-12-2020 16:30,@MichaelZemanek1 He is a flagrant liar #PfizerBioNTech  have enough. #Trump just didn’t order enough. Probably beca… https://t.co/vmkOELV5zJ,MichaelZemanek1 He is a flagrant liar PfizerBioNTech have enough Trump just didnt order enough Probably beca,"{'neg': 0.191, 'neu': 0.809, 'pos': 0.0, 'compound': -0.5106}",-0.5106,negative,-1,['pfizer']
969,1.34033e+18,Dr. Taha Khan,19-12-2020 16:21,Ecstatic &amp; grateful that I #GotTheShot (Dose #1 of the #PfizerBioNTech #vaccine) today! This is for all the the sci… https://t.co/wYOzMSkeBX,Ecstatic amp grateful that I GotTheShot Dose 1 of the PfizerBioNTech vaccine today This is for all the the sci,"{'neg': 0.0, 'neu': 0.717, 'pos': 0.283, 'compound': 0.743}",0.743,positive,1,['pfizer']
970,1.34033e+18,Rachna Tandon,19-12-2020 16:21,A side-by-side comparison of the #PfizerBioNTech and #Moderna #COVID19vaccines   https://t.co/J2jujrzo4T,A sidebyside comparison of the PfizerBioNTech and Moderna COVID19vaccines,"{'neg': 0.0, 'neu': 1.0, 'pos': 0.0, 'compound': 0.0}",0.0,neuteral,0,"['pfizer', 'moderna']"
971,1.34033e+18,Rachel McNeill,19-12-2020 16:15,Fantastic Explainer: How the #Moderna #vaccine stacks up against #PfizerBioNTech - ⁦@Reuters⁩ #CovidVaccine  https://t.co/kdBgR16NBp,Fantastic Explainer How the Moderna vaccine stacks up against PfizerBioNTech Reuters CovidVaccine,"{'neg': 0.0, 'neu': 0.753, 'pos': 0.247, 'compound': 0.5574}",0.5574,positive,1,"['pfizer', 'moderna']"
972,1.34033e+18,Prakash Singh,19-12-2020 16:03,#PfizerBioNTech #COVID19Vaccine#Dryice shipper box is good solution for -70 degree Celsius temperature https://t.co/FpiA8pGCcr,PfizerBioNTech COVID19VaccineDryice shipper box is good solution for 70 degree Celsius temperature,"{'neg': 0.0, 'neu': 0.658, 'pos': 0.342, 'compound': 0.6369}",0.6369,positive,1,['pfizer']
973,1.34032e+18,"Whitney McCarthy, M.D.",19-12-2020 15:50,"Just got my safe and effective COVID vaccine, which was seriously the best Christmas gift possible, thanks to the b… https://t.co/CEWVYah1kk",Just got my safe and effective COVID vaccine which was seriously the best Christmas gift possible thanks to the b,"{'neg': 0.055, 'neu': 0.423, 'pos': 0.521, 'compound': 0.936}",0.936,positive,1,[]
974,1.34032e+18,Elmar,19-12-2020 15:29,Nice wrap-up of the #biontech #Pfizer #PfizerBioNTech vaccine administration and approval process. https://t.co/ddwHAFHCtN,Nice wrapup of the biontech Pfizer PfizerBioNTech vaccine administration and approval process,"{'neg': 0.0, 'neu': 0.629, 'pos': 0.371, 'compound': 0.7096}",0.7096,positive,1,['pfizer']
975,1.34199e+18,Worldwide Tamils,24-12-2020 06:03,"#AstraZeneca vaccine by the Oxford University, 
#Moderna, 
#PfizerBiontech, 
#SputnikV, by Gamaleya vaccines have b… https://t.co/gNQxHFCUbv",AstraZeneca vaccine by the Oxford University Moderna PfizerBiontech SputnikV by Gamaleya vaccines have b,"{'neg': 0.0, 'neu': 1.0, 'pos': 0.0, 'compound': 0.0}",0.0,neuteral,0,"['pfizer', 'astrazeneca', 'moderna', 'sputnik']"
976,1.3415e+18,PH Dousma,22-12-2020 21:35,"#COVID19 #Vaccine #AstraZenecaOxfordJenner
#VaccineShouldQmarkBeEffective
Comment: 12222020
AstraZeneca has to chec… https://t.co/tQnWZxn9lB",COVID19 Vaccine AstraZenecaOxfordJenner VaccineShouldQmarkBeEffective Comment 12222020 AstraZeneca has to chec,"{'neg': 0.0, 'neu': 1.0, 'pos': 0.0, 'compound': 0.0}",0.0,neuteral,0,['astrazeneca']
977,1.34146e+18,Megha,22-12-2020 19:13,"Sahin, the child of a car factory worker, was introduced to it from science books. Türeci, grew up watching her sur… https://t.co/Z9Z9a2AJ1O",Sahin the child of a car factory worker was introduced to it from science books Türeci grew up watching her sur,"{'neg': 0.0, 'neu': 1.0, 'pos': 0.0, 'compound': 0.0}",0.0,neuteral,0,[]
978,1.34105e+18,New Straits Times,21-12-2020 16:03,"#NSTworld ""I am delighted to announce that the #EMA scientific committee met today and recommended a conditional ma… https://t.co/wtvAsczq43",NSTworld I am delighted to announce that the EMA scientific committee met today and recommended a conditional ma,"{'neg': 0.0, 'neu': 0.733, 'pos': 0.267, 'compound': 0.6249}",0.6249,positive,1,[]
979,1.34105e+18,Vishwas Gaitonde,21-12-2020 16:00,The US #FDA has approved two #coronavirus vaccines: #PfizerBioNTech &amp; #Moderna. Over 200 #vaccines are being develo… https://t.co/rTJIfXJmTM,The US FDA has approved two coronavirus vaccines PfizerBioNTech amp Moderna Over 200 vaccines are being develo,"{'neg': 0.0, 'neu': 0.851, 'pos': 0.149, 'compound': 0.4215}",0.4215,positive,1,"['pfizer', 'moderna']"
980,1.34105e+18,Sophie Sweatman,21-12-2020 15:57,#PfizerBioNTech it seems to me the government agenda is focused on maximum ROI from vaccines not on public health a… https://t.co/PT0Whuj98t,PfizerBioNTech it seems to me the government agenda is focused on maximum ROI from vaccines not on public health a,"{'neg': 0.0, 'neu': 0.874, 'pos': 0.126, 'compound': 0.3818}",0.3818,positive,1,['pfizer']
981,1.34105e+18,Cristina Dragani,21-12-2020 15:45,"This is a good day for #Europe, as the EMA has given approval for the widespread use of the #PfizerBioNTech… https://t.co/kaXWkqdYZ2",This is a good day for Europe as the EMA has given approval for the widespread use of the PfizerBioNTech,"{'neg': 0.0, 'neu': 0.739, 'pos': 0.261, 'compound': 0.7184}",0.7184,positive,1,['pfizer']
982,1.34105e+18,New Straits Times,21-12-2020 15:42,#NSTworld  #Singapore received #Asia's first delivery of the #PfizerBioNTech #coronavirus #vaccine on Monday.… https://t.co/uTyyFFW3O9,NSTworld Singapore received Asias first delivery of the PfizerBioNTech coronavirus vaccine on Monday,"{'neg': 0.0, 'neu': 1.0, 'pos': 0.0, 'compound': 0.0}",0.0,neuteral,0,['pfizer']
983,1.34104e+18,Monica Fibonacci🇨🇦,21-12-2020 15:31,"Gov picked elderly as the first test group.

Is that because Trudó have more respect for them? 

Or because they ar… https://t.co/0m0QWL94Zn",Gov picked elderly as the first test group Is that because Trudó have more respect for them Or because they ar,"{'neg': 0.0, 'neu': 0.855, 'pos': 0.145, 'compound': 0.5256}",0.5256,positive,1,[]
984,1.34104e+18,Prof Asif Ahmed,21-12-2020 15:29,"#PfizerBioNTech vaccine approved by MHRA, FDA and EMA. 

What more do you want to know? Get vaccinated ASAP if you… https://t.co/KYFCchYGyk",PfizerBioNTech vaccine approved by MHRA FDA and EMA What more do you want to know Get vaccinated ASAP if you,"{'neg': 0.0, 'neu': 0.805, 'pos': 0.195, 'compound': 0.5209}",0.5209,positive,1,['pfizer']
985,1.34104e+18,MarcoBigazzi🇮🇹🇪🇺#facciamorete#FBPE,21-12-2020 15:14,"Ready
Set
Go

#PfizerBioNTech 
#Ema",Ready Set Go PfizerBioNTech Ema,"{'neg': 0.0, 'neu': 0.615, 'pos': 0.385, 'compound': 0.3612}",0.3612,positive,1,['pfizer']
986,1.34104e+18,BizTek India,21-12-2020 15:00,Leading medial experts have said that existing vaccines for COVID-19 will be effective in fighting off infection fr… https://t.co/moHAWLny5M,Leading medial experts have said that existing vaccines for COVID19 will be effective in fighting off infection fr,"{'neg': 0.116, 'neu': 0.741, 'pos': 0.144, 'compound': 0.1531}",0.1531,positive,1,[]
987,1.34103e+18,Opoyi,21-12-2020 14:31,The European Medicines Agency has approved the #PfizerBioNTech #COVID19 #vaccine with the #EuropeanUnion slated to… https://t.co/iLrAgkTfAI,The European Medicines Agency has approved the PfizerBioNTech COVID19 vaccine with the EuropeanUnion slated to,"{'neg': 0.0, 'neu': 0.833, 'pos': 0.167, 'compound': 0.4215}",0.4215,positive,1,['pfizer']
988,1.34102e+18,Asiya Bakht,21-12-2020 13:49,So excited that the first shipment of  #PfizerBioNTech has arrived in Singapore.,So excited that the first shipment of PfizerBioNTech has arrived in Singapore,"{'neg': 0.0, 'neu': 0.803, 'pos': 0.197, 'compound': 0.4005}",0.4005,positive,1,['pfizer']
989,1.34101e+18,Harshvardhan Patel,21-12-2020 13:31,"So this is happening. Don’t know if the #PfizerBioNTech vaccine is geared for this new challenge.

Somehow the sayi… https://t.co/jij0olfHdg",So this is happening Dont know if the PfizerBioNTech vaccine is geared for this new challenge Somehow the sayi,"{'neg': 0.0, 'neu': 0.933, 'pos': 0.067, 'compound': 0.0772}",0.0772,positive,1,['pfizer']
990,1.34101e+18,GlendaChong,21-12-2020 13:00,"BREAKING:
#Singapore 's 1st batch of #COVID19 #vaccines from #PfizerBioNTech have arrived at @ChangiAirport

pix… https://t.co/JXI9yfp1SB",BREAKING Singapore s 1st batch of COVID19 vaccines from PfizerBioNTech have arrived at ChangiAirport pix,"{'neg': 0.0, 'neu': 1.0, 'pos': 0.0, 'compound': 0.0}",0.0,neuteral,0,['pfizer']
991,1.341e+18,monika_dutt,21-12-2020 12:55,This is a great summary of evidence on the #PfizerBioNTech #COVID19 #vaccine; particularly helpful for primary care… https://t.co/3Mcsa2uL1f,This is a great summary of evidence on the PfizerBioNTech COVID19 vaccine particularly helpful for primary care,"{'neg': 0.0, 'neu': 0.556, 'pos': 0.444, 'compound': 0.8858}",0.8858,positive,1,['pfizer']
992,1.341e+18,Nicole Osei,21-12-2020 12:54,Moderna's #COVID19 vaccine joins Pfizer Biontech's vaccine in the battle against the pandemic. Millions of doses ar… https://t.co/ObE37FXc0s,Modernas COVID19 vaccine joins Pfizer Biontechs vaccine in the battle against the pandemic Millions of doses ar,"{'neg': 0.14, 'neu': 0.86, 'pos': 0.0, 'compound': -0.3818}",-0.3818,negative,-1,"['pfizer', 'moderna']"
993,1.341e+18,Vijay Raj,21-12-2020 12:22,Is Pfizer’s COVID vaccine 💉 mfgd in China 🇨🇳? Can someone help me about this ? #Pfizervaccine #PfizerBioNTech… https://t.co/DUfGcNKvbU,Is Pfizers COVID vaccine mfgd in China Can someone help me about this Pfizervaccine PfizerBioNTech,"{'neg': 0.0, 'neu': 0.838, 'pos': 0.162, 'compound': 0.4019}",0.4019,positive,1,['pfizer']
994,1.34099e+18,New Straits Times,21-12-2020 12:16,#NSTnation The National Pharmaceutical Regulatory Agency (#NPRA) has received an application to register the… https://t.co/AyDIFsCrGZ,NSTnation The National Pharmaceutical Regulatory Agency NPRA has received an application to register the,"{'neg': 0.0, 'neu': 1.0, 'pos': 0.0, 'compound': 0.0}",0.0,neuteral,0,[]
995,1.34099e+18,Joseph MD,21-12-2020 12:15,So many feelings #COVID19 #PfizerBioNTech https://t.co/K0UENY3KlA,So many feelings COVID19 PfizerBioNTech,"{'neg': 0.0, 'neu': 1.0, 'pos': 0.0, 'compound': 0.0}",0.0,neuteral,0,['pfizer']
996,1.34099e+18,Ayah Galal,21-12-2020 12:04,"JUST IN: @GovNedLamont has announced approval of Moderna’s vaccine. The governor says CT is expecting 63,300 doses… https://t.co/4hDtQ5b3Ap",JUST IN GovNedLamont has announced approval of Modernas vaccine The governor says CT is expecting 63300 doses,"{'neg': 0.0, 'neu': 0.838, 'pos': 0.162, 'compound': 0.4767}",0.4767,positive,1,['moderna']
997,1.34099e+18,eurotopics [en],21-12-2020 11:46,"The European Medicines Agency expected to approve the #PfizerBioNTech vaccine today.

Commentators ask what Europe… https://t.co/TmMFywuvkg",The European Medicines Agency expected to approve the PfizerBioNTech vaccine today Commentators ask what Europe,"{'neg': 0.0, 'neu': 1.0, 'pos': 0.0, 'compound': 0.0}",0.0,neuteral,0,['pfizer']
998,1.34099e+18,Tamer Yazar,21-12-2020 11:45,"from #COVID19 to #COVID20 !
-
Rachel Shields-Carnley, a nurse at Ascension St. John, receives the #PfizerBioNTech… https://t.co/1eoy592IzM",from COVID19 to COVID20 Rachel ShieldsCarnley a nurse at Ascension St John receives the PfizerBioNTech,"{'neg': 0.0, 'neu': 1.0, 'pos': 0.0, 'compound': 0.0}",0.0,neuteral,0,['pfizer']
999,1.34099e+18,Zeinobia is at home 🏡,21-12-2020 11:39,#Qatar authorizes emergency use for #PfizerBioNTech's #COVID19 #vaccine Ministry of Public Health Issues Emergency… https://t.co/VchI5LBbtf,Qatar authorizes emergency use for PfizerBioNTechs COVID19 vaccine Ministry of Public Health Issues Emergency,"{'neg': 0.302, 'neu': 0.698, 'pos': 0.0, 'compound': -0.6369}",-0.6369,negative,-1,['pfizer']
1000,1.34098e+18,Rebecca Dunkerley,21-12-2020 11:15,"And just like that 1 jab down, 1 to go! Thanks Dr Ammara Hughes for vaccinating me. Helping towards 70% target for… https://t.co/EndVSDcBeB",And just like that 1 jab down 1 to go Thanks Dr Ammara Hughes for vaccinating me Helping towards 70 target for,"{'neg': 0.0, 'neu': 0.691, 'pos': 0.309, 'compound': 0.765}",0.765,positive,1,[]
1001,1.34098e+18,ECOMNEWSMED,21-12-2020 11:00,"#Tunisia: As part of the fight against #Covid19, the Ministry of Health has concluded an agreement with… https://t.co/qzRp9WfBqL",Tunisia As part of the fight against Covid19 the Ministry of Health has concluded an agreement with,"{'neg': 0.125, 'neu': 0.721, 'pos': 0.154, 'compound': 0.1531}",0.1531,positive,1,[]
1002,1.34096e+18,Igor Windisch,21-12-2020 09:46,Anyone knows if the #PfizerBioNTech / #Moderna vaccines have any efficiency vs. this new #Variant ? #OOTT @markets,Anyone knows if the PfizerBioNTech Moderna vaccines have any efficiency vs this new Variant OOTT markets,"{'neg': 0.0, 'neu': 0.857, 'pos': 0.143, 'compound': 0.3612}",0.3612,positive,1,"['pfizer', 'moderna']"
1003,1.34095e+18,Usmaan Hafiz,21-12-2020 09:38,"After weeks of preparation, reviewing PGDs, writing PSDs &amp; SOPs, webinars, meetings with vaccinators, not to mentio… https://t.co/oPBuEPpu58",After weeks of preparation reviewing PGDs writing PSDs amp SOPs webinars meetings with vaccinators not to mentio,"{'neg': 0.0, 'neu': 1.0, 'pos': 0.0, 'compound': 0.0}",0.0,neuteral,0,[]
1004,1.34094e+18,Millen,21-12-2020 08:29,The #PfizerBioNTech    and #Moderna  vaccines induce an immune response only to the spike protein carried by the co… https://t.co/kQ47BXeEOs,The PfizerBioNTech and Moderna vaccines induce an immune response only to the spike protein carried by the co,"{'neg': 0.0, 'neu': 0.885, 'pos': 0.115, 'compound': 0.296}",0.296,positive,1,"['pfizer', 'moderna']"
1005,1.34092e+18,حسن سجواني 🇦🇪 Hassan Sajwani,21-12-2020 07:17,Oman to receive its first #PfizerBioNTech vaccine shipments next Wednesday- Al Arabiya,Oman to receive its first PfizerBioNTech vaccine shipments next Wednesday Al Arabiya,"{'neg': 0.0, 'neu': 1.0, 'pos': 0.0, 'compound': 0.0}",0.0,neuteral,0,['pfizer']
1006,1.34091e+18,The Daily Star,21-12-2020 06:48,"#Qatar's Ministry of Public Health approved on Sunday the Pfizer and BioNTech #Covid_19 vaccine for emergency use,… https://t.co/dS6aaRnCVG",Qatars Ministry of Public Health approved on Sunday the Pfizer and BioNTech Covid_19 vaccine for emergency use,"{'neg': 0.127, 'neu': 0.735, 'pos': 0.137, 'compound': 0.0516}",0.0516,positive,1,['pfizer']
1007,1.34091e+18,Kyri Christodoulou,21-12-2020 06:35,"#covid_19 #PfizerBioNTech #vaccines 
If clearance is granted by EMA, the final hurdle is approval by the ⁦… https://t.co/DGJLO0vxXu",covid_19 PfizerBioNTech vaccines If clearance is granted by EMA the final hurdle is approval by the,"{'neg': 0.0, 'neu': 0.733, 'pos': 0.267, 'compound': 0.6249}",0.6249,positive,1,['pfizer']
1008,1.34089e+18,🚶🏻Curtis S. Chin,21-12-2020 05:03,"#USA 🇺🇸🦠💉 #AmericanSamoa 🇦🇸

📷: Director of Health Motusa Tuileama Nua was injected with the #PfizerBioNTech… https://t.co/tMPQHQQVv1",USA AmericanSamoa Director of Health Motusa Tuileama Nua was injected with the PfizerBioNTech,"{'neg': 0.0, 'neu': 1.0, 'pos': 0.0, 'compound': 0.0}",0.0,neuteral,0,['pfizer']
1009,1.34088e+18,Glocalex,21-12-2020 04:42,"Brazilian President @jairbolsonaro, a far-right leader, doubting COVID-19 called it 'a little flu', now raised the… https://t.co/7ZpiZ5AZaj",Brazilian President jairbolsonaro a farright leader doubting COVID19 called it a little flu now raised the,"{'neg': 0.282, 'neu': 0.718, 'pos': 0.0, 'compound': -0.5729}",-0.5729,negative,-1,[]
1010,1.34086e+18,Nurse Batman,21-12-2020 03:36,Had my fist dose of Pfizer vaccine yesterday. Today I was so tired and felt like I had a low grade fever when I did… https://t.co/87i6GZcyvx,Had my fist dose of Pfizer vaccine yesterday Today I was so tired and felt like I had a low grade fever when I did,"{'neg': 0.222, 'neu': 0.683, 'pos': 0.095, 'compound': -0.5173}",-0.5173,negative,-1,['pfizer']
1011,1.34083e+18,Cindy,21-12-2020 01:11,"I Got Vaccinated https://t.co/ICQlCvkFxa 

#GoTMMC #wedidIt #covidVaccine #PfizerBioNTech #RNLife #FrontlineFirst… https://t.co/NDLjZS40ii",I Got Vaccinated GoTMMC wedidIt covidVaccine PfizerBioNTech RNLife FrontlineFirst,"{'neg': 0.0, 'neu': 1.0, 'pos': 0.0, 'compound': 0.0}",0.0,neuteral,0,['pfizer']
1012,1.34082e+18,"Meg Wallace, LISW-CP",21-12-2020 00:33,"Crying happy tears as my mom, who works in cardiology and has gone to her office every day since the pandemic start… https://t.co/mE9tpuEcdS",Crying happy tears as my mom who works in cardiology and has gone to her office every day since the pandemic start,"{'neg': 0.181, 'neu': 0.686, 'pos': 0.134, 'compound': -0.0772}",-0.0772,negative,-1,[]
1013,1.34082e+18,Nemy Banthia,21-12-2020 00:32,"Once believed to be stable, #CoronaVirus is now showing up with mutated strains ! This may make the #CoronaVaccine… https://t.co/aFicsD51Uf",Once believed to be stable CoronaVirus is now showing up with mutated strains This may make the CoronaVaccine,"{'neg': 0.108, 'neu': 0.784, 'pos': 0.108, 'compound': 0.0}",0.0,neuteral,0,[]
1014,1.34082e+18,IBTimes 🇮🇳,21-12-2020 00:27,"#ICYMI I'm feeling dizzy: US nurse faints after getting Pfizer COVID vaccine shot

▪️A nurse at a Tennessee hospita… https://t.co/fYOnY7mo1E",ICYMI Im feeling dizzy US nurse faints after getting Pfizer COVID vaccine shot A nurse at a Tennessee hospita,"{'neg': 0.103, 'neu': 0.815, 'pos': 0.082, 'compound': -0.1027}",-0.1027,negative,-1,['pfizer']
1015,1.34081e+18,Hussain Maqbool Ahmed,21-12-2020 00:02,"Are #PfizerBioNTech and #Moderna giving immunity against all strains of #COVID19?

#coronavirus #VaccinesWork #MutantStrain #Mutation",Are PfizerBioNTech and Moderna giving immunity against all strains of COVID19 coronavirus VaccinesWork MutantStrain Mutation,"{'neg': 0.125, 'neu': 0.739, 'pos': 0.136, 'compound': 0.0516}",0.0516,positive,1,"['pfizer', 'moderna']"
1016,1.3408e+18,Cone Health Internal Medicine Residency,20-12-2020 23:22,Our program director Dr. Mullen (@ebmullen16) leading the way #Covid_19 #Vaccine #PfizerBioNTech 💉 https://t.co/DBBkxeKF6r,Our program director Dr Mullen ebmullen16 leading the way Covid_19 Vaccine PfizerBioNTech,"{'neg': 0.0, 'neu': 1.0, 'pos': 0.0, 'compound': 0.0}",0.0,neuteral,0,['pfizer']
1017,1.3408e+18,"Katharine Liang, MD, PhD",20-12-2020 23:06,"So grateful to the scientists at #PfizerBioNTech, and the basic scientists Barney Graham, @kkariko, Drew Weissman,… https://t.co/hl0Zy2zlyT",So grateful to the scientists at PfizerBioNTech and the basic scientists Barney Graham kkariko Drew Weissman,"{'neg': 0.0, 'neu': 0.82, 'pos': 0.18, 'compound': 0.5095}",0.5095,positive,1,['pfizer']
1018,1.34079e+18,SuperRetroThrowback,20-12-2020 22:49,Who did this?! 😂😂😂😂 #Covid_19 #Pfizer #vaccine #PfizerBioNTech https://t.co/DqDNqFatZo,Who did this Covid_19 Pfizer vaccine PfizerBioNTech,"{'neg': 0.0, 'neu': 1.0, 'pos': 0.0, 'compound': 0.0}",0.0,neuteral,0,['pfizer']
1019,1.34079e+18,Meggan Beebe,20-12-2020 22:46,Thankful. Hopeful. 💉 #uchicagomedicine #thisisourshot #notthrowingawaymyshot #PfizerBioNTech https://t.co/zRGP0QH7Qt,Thankful Hopeful uchicagomedicine thisisourshot notthrowingawaymyshot PfizerBioNTech,"{'neg': 0.0, 'neu': 0.364, 'pos': 0.636, 'compound': 0.7906}",0.7906,positive,1,['pfizer']
1020,1.34079e+18,RAVEEN,20-12-2020 22:26,"🔴 mRNA vaccine efficacy not affected by mutation, “You don't have to worry about it.” - BioNTech CEO #PfizerBioNTech",mRNA vaccine efficacy not affected by mutation You dont have to worry about it BioNTech CEO PfizerBioNTech,"{'neg': 0.0, 'neu': 0.796, 'pos': 0.204, 'compound': 0.431}",0.431,positive,1,['pfizer']
1021,1.34078e+18,JULIUS (he/him),20-12-2020 22:17,"Hey @OpenAcademics/@AcademicChatter  and mostly vaccine people :)
Where do I find WHICH protein exactly the Pfizer… https://t.co/ID10pOJ0no",Hey OpenAcademicsAcademicChatter and mostly vaccine people Where do I find WHICH protein exactly the Pfizer,"{'neg': 0.0, 'neu': 1.0, 'pos': 0.0, 'compound': 0.0}",0.0,neuteral,0,['pfizer']
1022,1.34078e+18,Whtrslugcaviiersong#dontstayhomeandcatchcovid19,20-12-2020 22:08,@grantshapps @AJRichardsonMP Get well soon #EmmanuelMacron #macron #frenchpresident #francepresident good you have… https://t.co/D9sCSPucNr,grantshapps AJRichardsonMP Get well soon EmmanuelMacron macron frenchpresident francepresident good you have,"{'neg': 0.0, 'neu': 0.667, 'pos': 0.333, 'compound': 0.6124}",0.6124,positive,1,[]
1023,1.34078e+18,Fena,20-12-2020 22:04,"Doctors Nura and Emir Festić: Those who do not get vaccinated are the brave ones
#COVID19 #CovidVaccine… https://t.co/kRYgbNCo9P",Doctors Nura and Emir Festić Those who do not get vaccinated are the brave ones COVID19 CovidVaccine,"{'neg': 0.0, 'neu': 0.825, 'pos': 0.175, 'compound': 0.5267}",0.5267,positive,1,[]
