,id,user_name,tweet_date,tweet_text,punc_text,scores,compound,sentiment,sentiment_bin,vaccine
1506,1.34116e+18,COVID-19 Made Simple,21-12-2020 23:25,"December 21, 2020🇨🇦

For more information on the COVID-19 pandemic across Canada and around the world, click the li… https://t.co/mZC9yHDdxm",December 21 2020 For more information on the COVID19 pandemic across Canada and around the world click the li,"{'neg': 0.0, 'neu': 1.0, 'pos': 0.0, 'compound': 0.0}",0.0,neuteral,0,[]
1507,1.34116e+18,Jeremy Song,21-12-2020 22:54,"President-elect #JoeBiden received his first dose of the #PfizerBioNTech  #COVID19 vaccine Monday.
The event was br… https://t.co/qs9CRvuPRp",Presidentelect JoeBiden received his first dose of the PfizerBioNTech COVID19 vaccine Monday The event was br,"{'neg': 0.0, 'neu': 1.0, 'pos': 0.0, 'compound': 0.0}",0.0,neuteral,0,['pfizer']
1508,1.34115e+18,Rula Awad,21-12-2020 22:28,".@pfizer sending @tiktok_us and @instagram influencers the #covid vaccine is genius!

Finally fighting back against… https://t.co/wFdIJgXrIV",pfizer sending tiktok_us and instagram influencers the covid vaccine is genius Finally fighting back against,"{'neg': 0.152, 'neu': 0.848, 'pos': 0.0, 'compound': -0.3612}",-0.3612,negative,-1,['pfizer']
1509,1.34115e+18,Time-to-eat-water,21-12-2020 22:24,"Does anyone know what ingredients are genuinely involved in this vaccine? 

I don't want it as a healthy young man,… https://t.co/VBQwPNlX5x",Does anyone know what ingredients are genuinely involved in this vaccine I dont want it as a healthy young man,"{'neg': 0.061, 'neu': 0.803, 'pos': 0.136, 'compound': 0.3565}",0.3565,positive,1,[]
1510,1.34115e+18,Stefan Kiwit,21-12-2020 22:15,... if your dick trusts us - your upper arm easily can! #vaccination #PfizerBioNTech,if your dick trusts us your upper arm easily can vaccination PfizerBioNTech,"{'neg': 0.185, 'neu': 0.506, 'pos': 0.309, 'compound': 0.296}",0.296,positive,1,['pfizer']
1511,1.34114e+18,Eb,21-12-2020 21:58,"@profvrr @alandove Thank you so much team for this edition! Unfortunately here in Australia, stupid… https://t.co/Q7d5QnaMl8",profvrr alandove Thank you so much team for this edition Unfortunately here in Australia stupid,"{'neg': 0.286, 'neu': 0.591, 'pos': 0.123, 'compound': -0.5106}",-0.5106,negative,-1,[]
1512,1.34114e+18,Yousef Kawar,21-12-2020 21:53,If 2020 was an ice cream #nyc #newyork #covid #COVID19 #Covid_19 #COVID20 #pandemic #coronavirus #icecream #park… https://t.co/1wxl79kPmJ,If 2020 was an ice cream nyc newyork covid COVID19 Covid_19 COVID20 pandemic coronavirus icecream park,"{'neg': 0.0, 'neu': 1.0, 'pos': 0.0, 'compound': 0.0}",0.0,neuteral,0,[]
1513,1.34114e+18,NATO,21-12-2020 21:45,"#MyCovidVax first shot #PfizerBioNTech to protect and keep my family, my friends, my colleagues, my neighbors, my p… https://t.co/qVlWaUy1W1",MyCovidVax first shot PfizerBioNTech to protect and keep my family my friends my colleagues my neighbors my p,"{'neg': 0.0, 'neu': 0.725, 'pos': 0.275, 'compound': 0.6908}",0.6908,positive,1,['pfizer']
1514,1.34113e+18,Tim Watkin,21-12-2020 21:21,"My Grandad is getting the first part of the #PfizerBioNTech #COVID19 vaccine tomorrow. 

—a great scientific achiev… https://t.co/5IBdSGcOtK",My Grandad is getting the first part of the PfizerBioNTech COVID19 vaccine tomorrow a great scientific achiev,"{'neg': 0.0, 'neu': 0.785, 'pos': 0.215, 'compound': 0.6249}",0.6249,positive,1,['pfizer']
1515,1.34113e+18,Peter Smart,21-12-2020 20:59,Hopefully the first step in putting this all behind us. Great service from the #COVID19 Vaccine team @setrust this… https://t.co/kACeWWLeo9,Hopefully the first step in putting this all behind us Great service from the COVID19 Vaccine team setrust this,"{'neg': 0.0, 'neu': 0.714, 'pos': 0.286, 'compound': 0.7783}",0.7783,positive,1,[]
1516,1.34113e+18,Modena,21-12-2020 20:58,I wasn't going to say anything about the #vaccine anymore but this crossed my path. Think twice about #vaccination… https://t.co/6M398tOeFL,I wasnt going to say anything about the vaccine anymore but this crossed my path Think twice about vaccination,"{'neg': 0.0, 'neu': 1.0, 'pos': 0.0, 'compound': 0.0}",0.0,neuteral,0,[]
1517,1.34113e+18,Ceri-Anne Ashby,21-12-2020 20:57,"48 hours post Covid vaccine and the pain in my arm has gone, I am tired but it's been a very long day - up at 4.30a… https://t.co/90b2cIJRyO",48 hours post Covid vaccine and the pain in my arm has gone I am tired but its been a very long day up at 430a,"{'neg': 0.157, 'neu': 0.843, 'pos': 0.0, 'compound': -0.4767}",-0.4767,negative,-1,[]
1518,1.34113e+18,Massimo Guerrera,21-12-2020 20:56,"Biden receives first dose of coronavirus vaccine publicly https://t.co/ZAqrhDLZwi
#Biden #BidenVaccine #PfizerBioNTech",Biden receives first dose of coronavirus vaccine publicly Biden BidenVaccine PfizerBioNTech,"{'neg': 0.0, 'neu': 1.0, 'pos': 0.0, 'compound': 0.0}",0.0,neuteral,0,['pfizer']
1519,1.34113e+18,PeggyER,21-12-2020 20:54,https://t.co/QDXSdWWWVm @pfizer #PfizerCOVIDvaccine #PfizerBioNTech #PfizerBioNTech Come on - give Pfizer placebo participants vaccine too,pfizer PfizerCOVIDvaccine PfizerBioNTech PfizerBioNTech Come on give Pfizer placebo participants vaccine too,"{'neg': 0.0, 'neu': 1.0, 'pos': 0.0, 'compound': 0.0}",0.0,neuteral,0,['pfizer']
1520,1.34112e+18,Laura Hogan,21-12-2020 20:53,"🚨NEW for @rtenews at 9 o'clock

🦠 Ireland is now in a ""Third Wave"" of this pandemic with people urged to stay at ho… https://t.co/loTVTSoWmt",NEW for rtenews at 9 oclock Ireland is now in a Third Wave of this pandemic with people urged to stay at ho,"{'neg': 0.0, 'neu': 1.0, 'pos': 0.0, 'compound': 0.0}",0.0,neuteral,0,[]
1521,1.34112e+18,NascoHealthcare,21-12-2020 20:50,President-elect #JoeBiden received his first dose of the #PfizerBioNTech coronavirus vaccine on Monday afternoon.… https://t.co/UzYoI7h7ih,Presidentelect JoeBiden received his first dose of the PfizerBioNTech coronavirus vaccine on Monday afternoon,"{'neg': 0.0, 'neu': 1.0, 'pos': 0.0, 'compound': 0.0}",0.0,neuteral,0,['pfizer']
1522,1.34112e+18,Andreas,21-12-2020 20:43,"So why do they call it the #oxfordvaccine, when it’s developed by Oxford &amp; #AstraZeneca , but #Pfizer  vaccine, whe… https://t.co/htn9jGUHIH",So why do they call it the oxfordvaccine when its developed by Oxford amp AstraZeneca but Pfizer vaccine whe,"{'neg': 0.0, 'neu': 1.0, 'pos': 0.0, 'compound': 0.0}",0.0,neuteral,0,"['pfizer', 'astrazeneca']"
1523,1.34112e+18,Lorraine Lundqvist,21-12-2020 20:42,"After you get the vaccine, how quickly does immunity kick in? For example, after you get the flu vaccine it takes t… https://t.co/Y8mfcdZdgv",After you get the vaccine how quickly does immunity kick in For example after you get the flu vaccine it takes t,"{'neg': 0.115, 'neu': 0.885, 'pos': 0.0, 'compound': -0.3818}",-0.3818,negative,-1,[]
1524,1.34112e+18,Dana RC,21-12-2020 20:40,Question: Should the #COVIDdeniers in the House and Senate be moved to the front of the #CovidVaccine vaccine line?… https://t.co/h2ssHv14lo,Question Should the COVIDdeniers in the House and Senate be moved to the front of the CovidVaccine vaccine line,"{'neg': 0.0, 'neu': 1.0, 'pos': 0.0, 'compound': 0.0}",0.0,neuteral,0,[]
1525,1.34112e+18,Nikole Killion,21-12-2020 20:38,"“We owe you big, we really do!” @JoeBiden gives kudos to frontline health workers including the nurse practitioner… https://t.co/yOdTT5GBQ4",We owe you big we really do JoeBiden gives kudos to frontline health workers including the nurse practitioner,"{'neg': 0.0, 'neu': 0.837, 'pos': 0.163, 'compound': 0.5106}",0.5106,positive,1,[]
1526,1.34112e+18,pdjmoo,21-12-2020 20:36,"@AmyMek @naomirwolf #CovidVaccine 
🆘 No wonder they wanted protection from liability. It's all on taxpayers now.
Th… https://t.co/kc2RYwkiQv",AmyMek naomirwolf CovidVaccine No wonder they wanted protection from liability Its all on taxpayers now Th,"{'neg': 0.222, 'neu': 0.778, 'pos': 0.0, 'compound': -0.4588}",-0.4588,negative,-1,[]
1527,1.34112e+18,Forbes Middle East,21-12-2020 20:29,The European Union’s drug regulator has approved the #PfizerBioNTech coronavirus vaccine for emergency use weeks af… https://t.co/xlUFuNHQsS,The European Unions drug regulator has approved the PfizerBioNTech coronavirus vaccine for emergency use weeks af,"{'neg': 0.134, 'neu': 0.722, 'pos': 0.144, 'compound': 0.0516}",0.0516,positive,1,['pfizer']
1528,1.34112e+18,Audrey Yeo,21-12-2020 20:29,I woke up with right deltoid pain this morning. High psychosomatic resemblance of the IM injection I've been thinki… https://t.co/u7tv6ORm6J,I woke up with right deltoid pain this morning High psychosomatic resemblance of the IM injection Ive been thinki,"{'neg': 0.163, 'neu': 0.837, 'pos': 0.0, 'compound': -0.5106}",-0.5106,negative,-1,[]
1529,1.34111e+18,Scott Mackay 🇨🇦 🏃‍♂️ ☕️ 🍷 8⃣0⃣ 🎵,21-12-2020 20:11,"@HannahThibedeau @carolemacneil @zchagla Q: When I receive my second dose of #PfizerBioNTech, and once 28 days or s… https://t.co/jHGypLMuyd",HannahThibedeau carolemacneil zchagla Q When I receive my second dose of PfizerBioNTech and once 28 days or s,"{'neg': 0.0, 'neu': 1.0, 'pos': 0.0, 'compound': 0.0}",0.0,neuteral,0,['pfizer']
1530,1.34111e+18,Steve Schiebel MD CPE FAAP,21-12-2020 20:02,Feeling fine at 48 hours!! #mildarmsoreness #48hourcheck #shot1done #VaccinesSaveLives #PfizerBioNTech #shot2in21days #signingofffornow,Feeling fine at 48 hours mildarmsoreness 48hourcheck shot1done VaccinesSaveLives PfizerBioNTech shot2in21days signingofffornow,"{'neg': 0.0, 'neu': 0.752, 'pos': 0.248, 'compound': 0.3182}",0.3182,positive,1,['pfizer']
1531,1.34111e+18,Financial Mirror,21-12-2020 19:55,"89 year old man died of #COVID19 in #Cyprus, raising #pandemic death toll to 96, revised after 4 other deaths were… https://t.co/Pryc1y5m3I",89 year old man died of COVID19 in Cyprus raising pandemic death toll to 96 revised after 4 other deaths were,"{'neg': 0.294, 'neu': 0.706, 'pos': 0.0, 'compound': -0.8176}",-0.8176,negative,-1,[]
1532,1.34111e+18,Kerry Sanders,21-12-2020 19:51,3500 #modernavaccine arrive at @BaptistHealthSF and put in freezers at neg 20f- this on top of the #PfizerBioNTech… https://t.co/9mgPMk6iGJ,3500 modernavaccine arrive at BaptistHealthSF and put in freezers at neg 20f this on top of the PfizerBioNTech,"{'neg': 0.058, 'neu': 0.847, 'pos': 0.095, 'compound': 0.1779}",0.1779,positive,1,"['pfizer', 'moderna']"
1533,1.34111e+18,AtomicReality,21-12-2020 19:46,"Coronavirus Update: Pfizer BioNTech COVID Vaccine Price https://t.co/uweqLk4rFF via @YouTube 

#Covid_19 
#Pfizer… https://t.co/RdcyJaZLGc",Coronavirus Update Pfizer BioNTech COVID Vaccine Price via YouTube Covid_19 Pfizer,"{'neg': 0.0, 'neu': 1.0, 'pos': 0.0, 'compound': 0.0}",0.0,neuteral,0,['pfizer']
1534,1.34111e+18,Rebecca Timmins,21-12-2020 19:44,@NHSuk Thank you @NHSuk for best christmas present ever . My 65 year old nhs worker mum vaccinated today against… https://t.co/Ll330KOUDc,NHSuk Thank you NHSuk for best christmas present ever My 65 year old nhs worker mum vaccinated today against,"{'neg': 0.0, 'neu': 0.717, 'pos': 0.283, 'compound': 0.7717}",0.7717,positive,1,[]
1535,1.34111e+18,euDebates.tv,21-12-2020 19:39,"Who will have the #Pfizer #PfizerBioNTech #vaccine first and when can I get it?
#CovidVaccine authorisation for Eur… https://t.co/hf2mingKBM",Who will have the Pfizer PfizerBioNTech vaccine first and when can I get it CovidVaccine authorisation for Eur,"{'neg': 0.0, 'neu': 1.0, 'pos': 0.0, 'compound': 0.0}",0.0,neuteral,0,['pfizer']
1536,1.3411e+18,Scott Mackay 🇨🇦 🏃‍♂️ ☕️ 🍷 8⃣0⃣ 🎵,21-12-2020 19:33,"#NewBrunswick reports 4 new cases of #COVID_19; ℹ️ A
 total of 1,871 individuals received their first dose of… https://t.co/P2TWdRabth",NewBrunswick reports 4 new cases of COVID_19 ℹ A total of 1871 individuals received their first dose of,"{'neg': 0.0, 'neu': 1.0, 'pos': 0.0, 'compound': 0.0}",0.0,neuteral,0,[]
1537,1.3411e+18,RAVEEN,21-12-2020 19:33,"🔴 European Union has approved the #PfizerBioNTech Coronavirus vaccine, the first inoculations to start across 27 co… https://t.co/csKXDdgGPW",European Union has approved the PfizerBioNTech Coronavirus vaccine the first inoculations to start across 27 co,"{'neg': 0.0, 'neu': 0.843, 'pos': 0.157, 'compound': 0.4215}",0.4215,positive,1,['pfizer']
1538,1.3411e+18,"Summit Shah, MD, MPH",21-12-2020 19:32,"Both #COVID19 vaccines are up to 95% effective and based on mRNA with similar mild side effect profile!
#Pfizer… https://t.co/98bcS88dTD",Both COVID19 vaccines are up to 95 effective and based on mRNA with similar mild side effect profile Pfizer,"{'neg': 0.0, 'neu': 0.853, 'pos': 0.147, 'compound': 0.4767}",0.4767,positive,1,['pfizer']
1539,1.3411e+18,Oscar H. Ramírez A.,21-12-2020 19:20,EU approves BioNTech-Pfizer COVID vaccine #COVID19  #PfizerBioNTech 💉 https://t.co/Cb3we7RMns,EU approves BioNTechPfizer COVID vaccine COVID19 PfizerBioNTech,"{'neg': 0.0, 'neu': 0.69, 'pos': 0.31, 'compound': 0.4019}",0.4019,positive,1,['pfizer']
1540,1.3411e+18,H24 News Ireland,21-12-2020 19:16,Health Minister Stephen Donnelly has said the Pfizer/BioNTech COVID-19 vaccine will be rolled out…… https://t.co/cdkFoah2MF,Health Minister Stephen Donnelly has said the PfizerBioNTech COVID19 vaccine will be rolled out,"{'neg': 0.0, 'neu': 1.0, 'pos': 0.0, 'compound': 0.0}",0.0,neuteral,0,['pfizer']
1541,1.3411e+18,H24,21-12-2020 19:14,"The European Commission has granted a conditional marketing authorization (CMA) for the #PfizerBioNTech vaccine, ma… https://t.co/bGc6iTrsE2",The European Commission has granted a conditional marketing authorization CMA for the PfizerBioNTech vaccine ma,"{'neg': 0.0, 'neu': 0.867, 'pos': 0.133, 'compound': 0.25}",0.25,positive,1,['pfizer']
1542,1.3411e+18,Brett Aronow,21-12-2020 19:12,Another serious question. Did any hospital workers in FL receive the #PfizerBioNTech vaccine? Or did FL wait an ent… https://t.co/hjSaRpqUvE,Another serious question Did any hospital workers in FL receive the PfizerBioNTech vaccine Or did FL wait an ent,"{'neg': 0.067, 'neu': 0.933, 'pos': 0.0, 'compound': -0.0772}",-0.0772,negative,-1,['pfizer']
1543,1.3411e+18,CONTACT LIGHT,21-12-2020 19:03,"#coronavirus  #BioNTech #Pfizer #PfizerBioNTech 

#Science will win... 

#sciencewillwin 

Let's make this #trending https://t.co/LPQxLSPlR6",coronavirus BioNTech Pfizer PfizerBioNTech Science will win sciencewillwin Lets make this trending,"{'neg': 0.0, 'neu': 0.743, 'pos': 0.257, 'compound': 0.5859}",0.5859,positive,1,['pfizer']
1544,1.3411e+18,Kerry Morgan,21-12-2020 19:00,After a very busy week I’ve managed to get back on social media and my whole feed is full of #CovidVaccine. I need… https://t.co/dA73ZBXgBv,After a very busy week Ive managed to get back on social media and my whole feed is full of CovidVaccine I need,"{'neg': 0.0, 'neu': 1.0, 'pos': 0.0, 'compound': 0.0}",0.0,neuteral,0,[]
1545,1.34109e+18,Qatar News,21-12-2020 18:43,"MOPH: COVID-19 vaccination in Qatar to start on December 23 
#Qatar #QatarNews #COVID19Vaccine #PfizerBioNTech 

https://t.co/WzhxYKr31U",MOPH COVID19 vaccination in Qatar to start on December 23 Qatar QatarNews COVID19Vaccine PfizerBioNTech,"{'neg': 0.0, 'neu': 1.0, 'pos': 0.0, 'compound': 0.0}",0.0,neuteral,0,['pfizer']
1546,1.34109e+18,Kessaikssa?,21-12-2020 18:41,"FN SCAR, Walther, tous les jours, fuck BioNTech

#Vaccin #PfizerBioNTech 
@freezecorleone",FN SCAR Walther tous les jours fuck BioNTech Vaccin PfizerBioNTech freezecorleone,"{'neg': 0.259, 'neu': 0.741, 'pos': 0.0, 'compound': -0.5423}",-0.5423,negative,-1,['pfizer']
1547,1.34109e+18,Prasad Welikumbura,21-12-2020 18:25,The first shipment of @pfizer-BioNTech #CovidVaccines💉 arrived in #Singapore 🇸🇬. Priority will be given to healthca… https://t.co/mGcDQyszlB,The first shipment of pfizerBioNTech CovidVaccines arrived in Singapore Priority will be given to healthca,"{'neg': 0.0, 'neu': 1.0, 'pos': 0.0, 'compound': 0.0}",0.0,neuteral,0,['pfizer']
1548,1.34109e+18,Laura Hogan,21-12-2020 18:20,🦠 Full report on #pfizerbiontech vaccine 💉 approval in Europe and the new strain of #Covid19 that could already be… https://t.co/vmBdGundyy,Full report on pfizerbiontech vaccine approval in Europe and the new strain of Covid19 that could already be,"{'neg': 0.059, 'neu': 0.788, 'pos': 0.153, 'compound': 0.4404}",0.4404,positive,1,['pfizer']
1549,1.34108e+18,FairFundingWokingham,21-12-2020 18:10,Please sign and retweet. Thank you. #COVID19 #Covid19UK #Covid_19 #schoolsuk #COVID20 #saveourschools #CovidVaccine… https://t.co/nVJUzJwcXa,Please sign and retweet Thank you COVID19 Covid19UK Covid_19 schoolsuk COVID20 saveourschools CovidVaccine,"{'neg': 0.0, 'neu': 0.696, 'pos': 0.304, 'compound': 0.5859}",0.5859,positive,1,[]
1550,1.34108e+18,Adrie Streefland,21-12-2020 18:03,The presentation of #EMA approval today for #Pfizer #CoronaVaccine ; looks like a remake of the #Cancer Vaccin pres… https://t.co/ZXht93HLKh,The presentation of EMA approval today for Pfizer CoronaVaccine looks like a remake of the Cancer Vaccin pres,"{'neg': 0.183, 'neu': 0.583, 'pos': 0.233, 'compound': 0.0516}",0.0516,positive,1,['pfizer']
1551,1.34108e+18,Carroll High School,21-12-2020 17:57,Dr. Lisa (Wahlrab) Walsh '05 became one of the first to receive the #PfizerBioNTech COVID-19 vaccine last week.  Re… https://t.co/T7liXXtc6I,Dr Lisa Wahlrab Walsh 05 became one of the first to receive the PfizerBioNTech COVID19 vaccine last week Re,"{'neg': 0.0, 'neu': 1.0, 'pos': 0.0, 'compound': 0.0}",0.0,neuteral,0,['pfizer']
1552,1.34108e+18,Simon Bloch,21-12-2020 17:54,"Is #PfizerBioNTech vaccine protecting against the new UK Covid variant? The answer is Yes, according to Evercore IS… https://t.co/eX0kKpmrJ2",Is PfizerBioNTech vaccine protecting against the new UK Covid variant The answer is Yes according to Evercore IS,"{'neg': 0.0, 'neu': 0.863, 'pos': 0.137, 'compound': 0.4019}",0.4019,positive,1,['pfizer']
1553,1.34108e+18,Heydiddledee,21-12-2020 17:54,I’m still waiting for someone to say that the vaccine is from Pfizer and Beyoncé. 😂 #COVID19 #pfizerbeyonce #PfizerBioNTech #coronavirus,Im still waiting for someone to say that the vaccine is from Pfizer and Beyoncé COVID19 pfizerbeyonce PfizerBioNTech coronavirus,"{'neg': 0.0, 'neu': 1.0, 'pos': 0.0, 'compound': 0.0}",0.0,neuteral,0,['pfizer']
1554,1.34108e+18,Émilie Vanderhulst 🇧🇪🇪🇺😷 #VaccinesWork,21-12-2020 17:39,"💉 Following @EMA_News recommendations released earlier today, the @EU_Commission grants marketing authorisation (co… https://t.co/8wNvzdqIiG",Following EMA_News recommendations released earlier today the EU_Commission grants marketing authorisation co,"{'neg': 0.0, 'neu': 0.853, 'pos': 0.147, 'compound': 0.2263}",0.2263,positive,1,[]
1555,1.34108e+18,_._SaRaVaNa_KuMaR_._,21-12-2020 17:39,"After #UK , #Canada and #US - now #Europe approves #PfizerBioNTech Covid vaccine..

#Valimai",After UK Canada and US now Europe approves PfizerBioNTech Covid vaccine Valimai,"{'neg': 0.0, 'neu': 0.803, 'pos': 0.197, 'compound': 0.4019}",0.4019,positive,1,['pfizer']
1556,1.34107e+18,"Meg Wallace, LISW-CP",21-12-2020 17:25,Two of three members of our household officially vaccinated. So thankful #CovidVaccine #PfizerBioNTech https://t.co/Y7DzkOG2pa,Two of three members of our household officially vaccinated So thankful CovidVaccine PfizerBioNTech,"{'neg': 0.0, 'neu': 0.75, 'pos': 0.25, 'compound': 0.6115}",0.6115,positive,1,['pfizer']
1557,1.34107e+18,Dr Jules Gomes,21-12-2020 17:25,"""Many of us would balk at accepting a cell line from the kidney of a Holocaust victim, even though that injustice f… https://t.co/2NBvrMwx1k",Many of us would balk at accepting a cell line from the kidney of a Holocaust victim even though that injustice f,"{'neg': 0.238, 'neu': 0.656, 'pos': 0.107, 'compound': -0.4939}",-0.4939,negative,-1,[]
1558,1.34107e+18,Gaggan Sabherwal,21-12-2020 17:22,Half a million people in Britain have now received their first dose of the Covid-19 #PfizerBioNTech vaccine.,Half a million people in Britain have now received their first dose of the Covid19 PfizerBioNTech vaccine,"{'neg': 0.0, 'neu': 1.0, 'pos': 0.0, 'compound': 0.0}",0.0,neuteral,0,['pfizer']
1559,1.34107e+18,Kathleen K.T. MD,21-12-2020 17:18,Seeing posts of my colleagues all over the US getting their shots of the #PfizerBioNTech vaccine- this is the true… https://t.co/xjtklLBCjh,Seeing posts of my colleagues all over the US getting their shots of the PfizerBioNTech vaccine this is the true,"{'neg': 0.0, 'neu': 0.872, 'pos': 0.128, 'compound': 0.4215}",0.4215,positive,1,['pfizer']
1560,1.34107e+18,Ahmed J Versi,21-12-2020 17:15,".@BorisJohnson said 500,000 people hav been vaccinated against #COVID19. UK has only recd 800,000 doses of the vacc… https://t.co/iXDYZLTCGi",BorisJohnson said 500000 people hav been vaccinated against COVID19 UK has only recd 800000 doses of the vacc,"{'neg': 0.0, 'neu': 1.0, 'pos': 0.0, 'compound': 0.0}",0.0,neuteral,0,[]
1561,1.34106e+18,Ramesh Bala,21-12-2020 16:53,"After #UK , #Canada and #US - now #Europe approves #PfizerBioNTech Covid vaccine..",After UK Canada and US now Europe approves PfizerBioNTech Covid vaccine,"{'neg': 0.0, 'neu': 0.787, 'pos': 0.213, 'compound': 0.4019}",0.4019,positive,1,['pfizer']
1562,1.34106e+18,Emily Pickle,21-12-2020 16:45,"Vaccine #1 accomplished! Small pinch, no burn at the push. In and out within 2 minutes. @orlandohealth has vaccinat… https://t.co/lqyzJ0Bjqf",Vaccine 1 accomplished Small pinch no burn at the push In and out within 2 minutes orlandohealth has vaccinat,"{'neg': 0.109, 'neu': 0.746, 'pos': 0.144, 'compound': 0.1779}",0.1779,positive,1,[]
1563,1.34106e+18,PhotoTelegram,21-12-2020 16:35,"EU watchdog approves #PfizerBioNTech #Vaccine https://t.co/qt3TDZPoF6 

#Pandemic",EU watchdog approves PfizerBioNTech Vaccine Pandemic,"{'neg': 0.0, 'neu': 0.649, 'pos': 0.351, 'compound': 0.4019}",0.4019,positive,1,['pfizer']
1564,1.34549e+18,T May,02-01-2021 21:48,"Interesting interview with John Moore, Professor of Microbiology and Immunology @Cornell by @AJEnglish re: UK appro… https://t.co/9PvzMrxqyU",Interesting interview with John Moore Professor of Microbiology and Immunology Cornell by AJEnglish re UK appro,"{'neg': 0.0, 'neu': 0.847, 'pos': 0.153, 'compound': 0.4019}",0.4019,positive,1,[]
1565,1.34461e+18,Allen Schrall,31-12-2020 11:28,The Vaccine rollout in the US is a Pathetic failure. Where are the Doses we were promised. Moderna &amp; Pfizer… https://t.co/SJN6KzilpS,The Vaccine rollout in the US is a Pathetic failure Where are the Doses we were promised Moderna amp Pfizer,"{'neg': 0.275, 'neu': 0.627, 'pos': 0.098, 'compound': -0.6705}",-0.6705,negative,-1,"['pfizer', 'moderna']"
1566,1.34322e+18,H24 News Ireland,27-12-2020 15:36,"Varadkar: Ireland 'will start slower, but catch up' on COVID vaccine | On The Record
👉 https://t.co/UAnA2CW3vz… https://t.co/Ye55ExnO14",Varadkar Ireland will start slower but catch up on COVID vaccine On The Record,"{'neg': 0.0, 'neu': 1.0, 'pos': 0.0, 'compound': 0.0}",0.0,neuteral,0,[]
1567,1.34316e+18,H24 News Ireland,27-12-2020 11:22,"Stephen Donnelly says arrival of coronavirus vaccine is 'a day of hope' | Newstalk
➡️ https://t.co/AixBYF9VNL… https://t.co/Q4rHoCXb7W",Stephen Donnelly says arrival of coronavirus vaccine is a day of hope Newstalk,"{'neg': 0.0, 'neu': 0.791, 'pos': 0.209, 'compound': 0.4404}",0.4404,positive,1,[]
1568,1.34296e+18,𝖋𝖊𝖑𝖎𝖕𝖊,26-12-2020 22:19,"Someone hacked the vaccine 
Get rekt #Pfizer 😅

#PfizerBioNTech #Pfizervaccine #vaccines
https://t.co/9pLRRaqfMN",Someone hacked the vaccine Get rekt Pfizer PfizerBioNTech Pfizervaccine vaccines,"{'neg': 0.231, 'neu': 0.769, 'pos': 0.0, 'compound': -0.4019}",-0.4019,negative,-1,['pfizer']
1569,1.34295e+18,Jen Allen,26-12-2020 22:01,Just got the call that I will be getting the #PfizerBioNTech #CovidVaccine next week at @grhospitalkw. Feeling like… https://t.co/EGEUnfH5dv,Just got the call that I will be getting the PfizerBioNTech CovidVaccine next week at grhospitalkw Feeling like,"{'neg': 0.0, 'neu': 0.789, 'pos': 0.211, 'compound': 0.4588}",0.4588,positive,1,['pfizer']
1570,1.34295e+18,ợµลℓเ†ý ลรลиลร,26-12-2020 21:30,Isn't William Shakespeare due his 2nd Covid shot? Where's the media at? #PfizerBioNTech https://t.co/bsUKjHJ7kO,Isnt William Shakespeare due his 2nd Covid shot Wheres the media at PfizerBioNTech,"{'neg': 0.0, 'neu': 1.0, 'pos': 0.0, 'compound': 0.0}",0.0,neuteral,0,['pfizer']
1571,1.34293e+18,Dr. Fahad Al-Kandari,26-12-2020 20:36,"When no one get vaccinated, The disease can spread easily.

#COVID19 #vaccination #PfizerBioNTech",When no one get vaccinated The disease can spread easily COVID19 vaccination PfizerBioNTech,"{'neg': 0.141, 'neu': 0.705, 'pos': 0.154, 'compound': 0.0516}",0.0516,positive,1,['pfizer']
1572,1.34292e+18,Allen Mo,26-12-2020 19:42,Belated X-mas/Boxing Day Gift! Thank you @MontefioreNYC and the scientists at #PfizerBioNTech! #CovidVaccine https://t.co/O1bjo4j4EG,Belated XmasBoxing Day Gift Thank you MontefioreNYC and the scientists at PfizerBioNTech CovidVaccine,"{'neg': 0.0, 'neu': 0.671, 'pos': 0.329, 'compound': 0.6597}",0.6597,positive,1,['pfizer']
1573,1.34292e+18,Eirini Zarkadoula,26-12-2020 19:39,Well sent well received #vaccination #vaccine #Covid #Pfizer #PfizerBioNTech https://t.co/TxPRhYT938,Well sent well received vaccination vaccine Covid Pfizer PfizerBioNTech,"{'neg': 0.0, 'neu': 0.625, 'pos': 0.375, 'compound': 0.4939}",0.4939,positive,1,['pfizer']
