,id,user_name,tweet_date,tweet_text,punc_text,scores,compound,sentiment,sentiment_bin,vaccine
479,1.33941e+18,BL-News | English,17-12-2020 03:02,"A health worker in Alaska has severe reaction to Pfizer vaccine 
#CoronaVirusDE 
#UKlockdown 
#Pfizervaccine… https://t.co/yKLp3Jr2kd",A health worker in Alaska has severe reaction to Pfizer vaccine CoronaVirusDE UKlockdown Pfizervaccine,"{'neg': 0.178, 'neu': 0.822, 'pos': 0.0, 'compound': -0.3818}",-0.3818,negative,-1,['pfizer']
480,1.33939e+18,"Melissa L. Wilk, PharmD",17-12-2020 02:12,PVD(post vaccine day)2... NO SIDE EFFECTS!!! #CovidVaccine #PfizerBioNTech,PVDpost vaccine day2 NO SIDE EFFECTS CovidVaccine PfizerBioNTech,"{'neg': 0.295, 'neu': 0.705, 'pos': 0.0, 'compound': -0.4466}",-0.4466,negative,-1,['pfizer']
481,1.33939e+18,Mena Botros,17-12-2020 02:08,"A little over 24 h after my #PfizerBioNTech #CovidVaccine and I'm lucky to say I have no symptoms, unless extra ene… https://t.co/lrpkvxhsQQ",A little over 24 h after my PfizerBioNTech CovidVaccine and Im lucky to say I have no symptoms unless extra ene,"{'neg': 0.105, 'neu': 0.762, 'pos': 0.133, 'compound': 0.1531}",0.1531,positive,1,['pfizer']
482,1.33939e+18,SFVaughn,17-12-2020 01:48,@realDonaldTrump takes credit for the Chinese providing #COVID19 genetic sequencing and #PfizerBioNTech rejecting f… https://t.co/l9Sqey4A12,realDonaldTrump takes credit for the Chinese providing COVID19 genetic sequencing and PfizerBioNTech rejecting f,"{'neg': 0.181, 'neu': 0.663, 'pos': 0.157, 'compound': -0.1027}",-0.1027,negative,-1,['pfizer']
483,1.33938e+18,Jackson Health System,17-12-2020 01:26,"Today we aimed higher and broke our own record! Jackson administered 1,278 #PfizerBioNTech vaccinations, bringing o… https://t.co/PidTky8n7g",Today we aimed higher and broke our own record Jackson administered 1278 PfizerBioNTech vaccinations bringing o,"{'neg': 0.167, 'neu': 0.833, 'pos': 0.0, 'compound': -0.4215}",-0.4215,negative,-1,['pfizer']
484,1.33938e+18,Dr.Krutika Kuppalli,17-12-2020 01:21,Lots of rumors going around about the #PfizerBioNTech #CovidVaccine and how they affect women of childbearing age-s… https://t.co/MrNsILUtfo,Lots of rumors going around about the PfizerBioNTech CovidVaccine and how they affect women of childbearing ages,"{'neg': 0.0, 'neu': 1.0, 'pos': 0.0, 'compound': 0.0}",0.0,neuteral,0,['pfizer']
485,1.33938e+18,Martha Bebinger,17-12-2020 01:08,And here's the fact sheet for recipients of the #PfizerBioNTech vaccine - in case you're in line for this one and w… https://t.co/h3hFL0xXqJ,And heres the fact sheet for recipients of the PfizerBioNTech vaccine in case youre in line for this one and w,"{'neg': 0.0, 'neu': 1.0, 'pos': 0.0, 'compound': 0.0}",0.0,neuteral,0,['pfizer']
486,1.33938e+18,"Stephanie Smith, PharmD, BCCCP",17-12-2020 01:06,There’s a light at the end of the tunnel! So proud of the incredible teamwork that went into making this possible.… https://t.co/UGybp2Cddn,Theres a light at the end of the tunnel So proud of the incredible teamwork that went into making this possible,"{'neg': 0.0, 'neu': 0.848, 'pos': 0.152, 'compound': 0.5256}",0.5256,positive,1,[]
487,1.33938e+18,Selcuk Acar,17-12-2020 01:02,Snow storm in #NYC #pandemic #weather #newyork #snowing #winter #darkwinter #vaccinated  #PfizerBioNTech  https://t.co/WW2sD8eqfR,Snow storm in NYC pandemic weather newyork snowing winter darkwinter vaccinated PfizerBioNTech,"{'neg': 0.0, 'neu': 1.0, 'pos': 0.0, 'compound': 0.0}",0.0,neuteral,0,['pfizer']
488,1.33937e+18,New Straits Times,17-12-2020 00:46,#NSTworld A health worker in #Alaska suffered a serious #allergic reaction after getting #PfizerBioNTech's #Covid19… https://t.co/tUVb7pismT,NSTworld A health worker in Alaska suffered a serious allergic reaction after getting PfizerBioNTechs Covid19,"{'neg': 0.401, 'neu': 0.599, 'pos': 0.0, 'compound': -0.6908}",-0.6908,negative,-1,['pfizer']
489,1.33937e+18,Marc Siegel MD,17-12-2020 00:45,Dr. Siegel: 'Historic day for science' in battle against COVID-19 | Fox News Video ⁦@AmericaNewsroom⁩ ⁦… https://t.co/Xj64Y9XkkO,Dr Siegel Historic day for science in battle against COVID19 Fox News Video AmericaNewsroom,"{'neg': 0.167, 'neu': 0.833, 'pos': 0.0, 'compound': -0.3818}",-0.3818,negative,-1,[]
490,1.33937e+18,Simon Hodes ⬅️2m➡️ 😷,17-12-2020 00:30,"💉Calling Health Care Professionals 

IF you were offered one of the extra doses of the #PfizerBioNTech vaccine (tha… https://t.co/cL36TfInfG",Calling Health Care Professionals IF you were offered one of the extra doses of the PfizerBioNTech vaccine tha,"{'neg': 0.0, 'neu': 0.842, 'pos': 0.158, 'compound': 0.4939}",0.4939,positive,1,['pfizer']
491,1.33937e+18,"Timothy Singer, MD, MS",17-12-2020 00:29,"Yes I got the #COVID19 vaccine tonight ⁦and no I’m not flexing! Grateful to receive it.

⁩#PfizerBioNTech… https://t.co/LEa0dm3OZe",Yes I got the COVID19 vaccine tonight and no Im not flexing Grateful to receive it PfizerBioNTech,"{'neg': 0.23, 'neu': 0.638, 'pos': 0.132, 'compound': -0.2453}",-0.2453,negative,-1,['pfizer']
492,1.33937e+18,Simon Hodes ⬅️2m➡️ 😷,17-12-2020 00:26,"Calling Health Care Professionals 

- IF you were offered one of the extra doses of the #PfizerBioNTech vaccine (th… https://t.co/RjHdurX9jp",Calling Health Care Professionals IF you were offered one of the extra doses of the PfizerBioNTech vaccine th,"{'neg': 0.0, 'neu': 0.842, 'pos': 0.158, 'compound': 0.4939}",0.4939,positive,1,['pfizer']
493,1.33937e+18,Will Lester,17-12-2020 00:21,ICU Nurse Sonya Harrell receives the first dose of the #PfizerBioNTech #COVID19Vaccine in San Bernardino County… https://t.co/GwFrVOOUzl,ICU Nurse Sonya Harrell receives the first dose of the PfizerBioNTech COVID19Vaccine in San Bernardino County,"{'neg': 0.0, 'neu': 1.0, 'pos': 0.0, 'compound': 0.0}",0.0,neuteral,0,['pfizer']
494,1.33936e+18,Emi Mei,17-12-2020 00:19,Don’t do the effin’ #vaccine #PfizerBioNTech #Pfizer #CovidVaccine #COVID19 https://t.co/pU1vUTrWnE,Dont do the effin vaccine PfizerBioNTech Pfizer CovidVaccine COVID19,"{'neg': 0.0, 'neu': 0.748, 'pos': 0.252, 'compound': 0.4023}",0.4023,positive,1,['pfizer']
495,1.33936e+18,"Samia Aleem, MD, MHSc",17-12-2020 00:14,"This is my younger brother @SalikAleemMD, a frontline #COVID19 ICU fellow @CarilionClinic, getting the first shot o… https://t.co/m0Y5sCrNum",This is my younger brother SalikAleemMD a frontline COVID19 ICU fellow CarilionClinic getting the first shot o,"{'neg': 0.0, 'neu': 1.0, 'pos': 0.0, 'compound': 0.0}",0.0,neuteral,0,[]
496,1.33936e+18,Simon Cambridge,17-12-2020 00:12,@Desuetudine @nytimes I knew there was lots of licking going on in the treasury! Bingham who was accused wasting bi… https://t.co/5ZAFECybbE,Desuetudine nytimes I knew there was lots of licking going on in the treasury Bingham who was accused wasting bi,"{'neg': 0.216, 'neu': 0.705, 'pos': 0.079, 'compound': -0.4767}",-0.4767,negative,-1,[]
497,1.33936e+18,Ian Bailey,17-12-2020 00:09,"24 new #Covid19 deaths in #BC as the province reports 640 new cases. 9, 950 active cases in #BC 
-New type of measu… https://t.co/htz9Xvbjvb",24 new Covid19 deaths in BC as the province reports 640 new cases 9 950 active cases in BC New type of measu,"{'neg': 0.0, 'neu': 0.886, 'pos': 0.114, 'compound': 0.4019}",0.4019,positive,1,[]
498,1.33936e+18,Glasgow Girl,16-12-2020 23:54,"Pfizer’s experimental covid-19 vaccine —What you’re NOT being told. 

Now more than ever before, we are in desperat… https://t.co/C07cVHnugM",Pfizers experimental covid19 vaccine What youre NOT being told Now more than ever before we are in desperat,"{'neg': 0.0, 'neu': 1.0, 'pos': 0.0, 'compound': 0.0}",0.0,neuteral,0,['pfizer']
499,1.33936e+18,Dr.Krutika Kuppalli,16-12-2020 23:52,It was a honor today to speak about the importance of the rollout of the #PfizerBioNTech  #COVID19Vaccine at… https://t.co/MbL4Obm6dh,It was a honor today to speak about the importance of the rollout of the PfizerBioNTech COVID19Vaccine at,"{'neg': 0.0, 'neu': 0.725, 'pos': 0.275, 'compound': 0.6908}",0.6908,positive,1,['pfizer']
500,1.33935e+18,Kenan,16-12-2020 23:38,"Hope for humanity! Important is science not nationality, race, ethnicity or religion. #coronavirus #vaccine… https://t.co/tHJj7VpIvi",Hope for humanity Important is science not nationality race ethnicity or religion coronavirus vaccine,"{'neg': 0.0, 'neu': 0.719, 'pos': 0.281, 'compound': 0.5719}",0.5719,positive,1,[]
501,1.33935e+18,Vishnu Kumar,16-12-2020 23:31,Roll up your sleeves and get the shot when it is your turn. Together we can end this. #COVID19 #CovidVaccines… https://t.co/xs4Ef9x4aW,Roll up your sleeves and get the shot when it is your turn Together we can end this COVID19 CovidVaccines,"{'neg': 0.0, 'neu': 1.0, 'pos': 0.0, 'compound': 0.0}",0.0,neuteral,0,[]
502,1.33935e+18,Christian “wear (a mask) because you care” Rose,16-12-2020 23:26,I feel like this today. #helmsdeep #PfizerBioNTech #VaccinesSaveLives https://t.co/NlBOYDN5Zo,I feel like this today helmsdeep PfizerBioNTech VaccinesSaveLives,"{'neg': 0.0, 'neu': 0.706, 'pos': 0.294, 'compound': 0.3612}",0.3612,positive,1,['pfizer']
503,1.33935e+18,Zahra Kassamali Escobar,16-12-2020 23:25,"@CDC's  pre #CovidVaccine  screening form for #PfizerBioNTech vaccine
https://t.co/H2wnWsRUpo https://t.co/j23w4c4zV9",CDCs pre CovidVaccine screening form for PfizerBioNTech vaccine,"{'neg': 0.0, 'neu': 1.0, 'pos': 0.0, 'compound': 0.0}",0.0,neuteral,0,['pfizer']
504,1.33935e+18,appdigitalcloud,16-12-2020 23:23,"Interesting🤔🤔

Explain: 

""I am 59 years old, I am in good health, I am not in the first line, so for my type it is… https://t.co/LeCy2tLjmA",Interesting Explain I am 59 years old I am in good health I am not in the first line so for my type it is,"{'neg': 0.0, 'neu': 0.781, 'pos': 0.219, 'compound': 0.6808}",0.6808,positive,1,[]
505,1.33935e+18,Miguel,16-12-2020 23:21,#COVID19 Was quite impressed when I heard the 1st number earlier today.  Bit of simple maths means the wider pictur… https://t.co/BH31msKypJ,COVID19 Was quite impressed when I heard the 1st number earlier today Bit of simple maths means the wider pictur,"{'neg': 0.0, 'neu': 0.784, 'pos': 0.216, 'compound': 0.5709}",0.5709,positive,1,[]
506,1.33935e+18,Dr. Demetri,16-12-2020 23:05,40 percent increase in EXISTING @pfizer and @BioNTech_Group VACCINE supply! The vials already provided contain up t… https://t.co/jkZ2B2Fu7l,40 percent increase in EXISTING pfizer and BioNTech_Group VACCINE supply The vials already provided contain up t,"{'neg': 0.0, 'neu': 0.867, 'pos': 0.133, 'compound': 0.3182}",0.3182,positive,1,['pfizer']
507,1.33934e+18,ToadSnob,16-12-2020 22:56,"Me waking up the day after getting the vaccine.  

#vaccination #CoronavirusVaccine #Pfizervaccine #COVID19Vaccine… https://t.co/SvY6tGR1Cj",Me waking up the day after getting the vaccine vaccination CoronavirusVaccine Pfizervaccine COVID19Vaccine,"{'neg': 0.0, 'neu': 1.0, 'pos': 0.0, 'compound': 0.0}",0.0,neuteral,0,['pfizer']
508,1.33934e+18,End the Kakistocracy,16-12-2020 22:55,"The pfizer vaccine ingredients are in this article, if you're looking for potential allergens.

(MRNA, Lipids, Salt… https://t.co/bgGMno5yen",The pfizer vaccine ingredients are in this article if youre looking for potential allergens MRNA Lipids Salt,"{'neg': 0.0, 'neu': 1.0, 'pos': 0.0, 'compound': 0.0}",0.0,neuteral,0,['pfizer']
509,1.33934e+18,Free Malaysia Today,16-12-2020 22:54,"It is to determine if it's still safe, effective after storage temperatures dipped below -80°C. #FMTNews… https://t.co/0xS5WilDbZ",It is to determine if its still safe effective after storage temperatures dipped below 80C FMTNews,"{'neg': 0.0, 'neu': 0.7, 'pos': 0.3, 'compound': 0.7184}",0.7184,positive,1,[]
510,1.33934e+18,Michael Kiernan,16-12-2020 22:53,Who should be getting the #COVID19 vaccine when it’s available in your locality....? #Pfizervaccine #PfizerBioNTech https://t.co/8IvPJTPRAq,Who should be getting the COVID19 vaccine when its available in your locality Pfizervaccine PfizerBioNTech,"{'neg': 0.0, 'neu': 1.0, 'pos': 0.0, 'compound': 0.0}",0.0,neuteral,0,['pfizer']
511,1.33934e+18,Jessica Lauren,16-12-2020 22:51,Got the COVID vaccine today. This is amazing. So happy to be able to get this! Feels like the world is finally turn… https://t.co/B64EjHOtNK,Got the COVID vaccine today This is amazing So happy to be able to get this Feels like the world is finally turn,"{'neg': 0.0, 'neu': 0.66, 'pos': 0.34, 'compound': 0.8832}",0.8832,positive,1,[]
512,1.33934e+18,A blessed dad,16-12-2020 22:50,Not a good start. Hope she recovers to full health. But this is one of the concerns of a rushed vaccine. #COVID19… https://t.co/krBN63JZ5D,Not a good start Hope she recovers to full health But this is one of the concerns of a rushed vaccine COVID19,"{'neg': 0.159, 'neu': 0.841, 'pos': 0.0, 'compound': -0.3412}",-0.3412,negative,-1,[]
513,1.33934e+18,Whtrslugcaviiersong#dontstayhomeandcatchcovid19,16-12-2020 22:44,@GER_OSCE @OSCE @IFSHHamburg @TheGCSP @SokovNikolai #Germany #AngelaMerkel #merkel #osce #fsc #armscontrol thanks e… https://t.co/GqQFaC7yaS,GER_OSCE OSCE IFSHHamburg TheGCSP SokovNikolai Germany AngelaMerkel merkel osce fsc armscontrol thanks e,"{'neg': 0.0, 'neu': 0.791, 'pos': 0.209, 'compound': 0.4404}",0.4404,positive,1,[]
514,1.33934e+18,"Justin Pedigo, PharmD, BCPS",16-12-2020 22:39,"Vaccinated! Painless injection, and I’m currently cruising social media during the 15 minute observation period.… https://t.co/kxEaaG9BrL",Vaccinated Painless injection and Im currently cruising social media during the 15 minute observation period,"{'neg': 0.0, 'neu': 0.864, 'pos': 0.136, 'compound': 0.296}",0.296,positive,1,[]
515,1.33934e+18,Zeinobia is at home 🏡,16-12-2020 22:27,Second shipment of #PfizerbioNTech #coronavirus #vaccine arrives #Riyadh #KSA Second shipment of Pf... via… https://t.co/Hoc3W6wNd3,Second shipment of PfizerbioNTech coronavirus vaccine arrives Riyadh KSA Second shipment of Pf via,"{'neg': 0.0, 'neu': 1.0, 'pos': 0.0, 'compound': 0.0}",0.0,neuteral,0,['pfizer']
516,1.33933e+18,XallyWho,16-12-2020 22:20,A healthcare worker in #Alaska had an anaphylactic reaction &amp; was hospitalized in ICU after receiving the… https://t.co/WE0s1APGhU,A healthcare worker in Alaska had an anaphylactic reaction amp was hospitalized in ICU after receiving the,"{'neg': 0.0, 'neu': 1.0, 'pos': 0.0, 'compound': 0.0}",0.0,neuteral,0,[]
517,1.33933e+18,Eric Deters,16-12-2020 22:15,"SHOW HIGHLIGHT: FDA Says Vaccine Might Give You Bell's Palsy
#CoronavirusVaccine #CoronaVirusUpdates #CovidVaccines… https://t.co/eyDgIOyFOA",SHOW HIGHLIGHT FDA Says Vaccine Might Give You Bells Palsy CoronavirusVaccine CoronaVirusUpdates CovidVaccines,"{'neg': 0.0, 'neu': 0.793, 'pos': 0.207, 'compound': 0.4824}",0.4824,positive,1,[]
518,1.33933e+18,Whtrslugcaviiersong#dontstayhomeandcatchcovid19,16-12-2020 22:14,@KensingtonRoyal So #scientists 🌎 haven't found HIV #vaccine &amp; some thought they might not find a… https://t.co/ksLiSUzEov,KensingtonRoyal So scientists havent found HIV vaccine amp some thought they might not find a,"{'neg': 0.0, 'neu': 1.0, 'pos': 0.0, 'compound': 0.0}",0.0,neuteral,0,[]
519,1.33933e+18,"Dr. Khaled Ouanes, Ph.D.",16-12-2020 22:03,"The #PfizerBioNTech COVID-19 vaccine: what's in it? Why? And how it works? 

#COVID19Vaccine #PfizerCOVIDvaccine https://t.co/VuxYwXBrow",The PfizerBioNTech COVID19 vaccine whats in it Why And how it works COVID19Vaccine PfizerCOVIDvaccine,"{'neg': 0.0, 'neu': 1.0, 'pos': 0.0, 'compound': 0.0}",0.0,neuteral,0,['pfizer']
520,1.33933e+18,Whtrslugcaviiersong#dontstayhomeandcatchcovid19,16-12-2020 21:56,@joelrwrites @AvonandsomerRob Did some say panic b'se #eu #theeu #europeanunion #eu27 #theeuropeanunion #EUleaders… https://t.co/u1ezd7vKsm,joelrwrites AvonandsomerRob Did some say panic bse eu theeu europeanunion eu27 theeuropeanunion EUleaders,"{'neg': 0.216, 'neu': 0.784, 'pos': 0.0, 'compound': -0.5106}",-0.5106,negative,-1,[]
521,1.33933e+18,timethief former paralegal judicial clerk,16-12-2020 21:55,"The #COVID19vaccine from #PfizerBioNTech is comprised of ingredients standard in many vaccines, including mRNA, lip… https://t.co/G22z8dowWf",The COVID19vaccine from PfizerBioNTech is comprised of ingredients standard in many vaccines including mRNA lip,"{'neg': 0.0, 'neu': 1.0, 'pos': 0.0, 'compound': 0.0}",0.0,neuteral,0,['pfizer']
522,1.33933e+18,Wear Active LLC,16-12-2020 21:54,"https://t.co/C8skAtpHUE

The first case of an allergic reaction from the Pfizer Vaccine. This was expected and is t… https://t.co/Ew4ipsT7fJ",The first case of an allergic reaction from the Pfizer Vaccine This was expected and is t,"{'neg': 0.128, 'neu': 0.872, 'pos': 0.0, 'compound': -0.296}",-0.296,negative,-1,['pfizer']
523,1.33932e+18,Wayne Cleghorn,16-12-2020 21:20,A celebration: @BioNTech_Group’s Ugur Sahin and Ozlem Tureci are @FT’s People of the Year 2020. #COVID19… https://t.co/YAwWH3Ah8T,A celebration BioNTech_Groups Ugur Sahin and Ozlem Tureci are FTs People of the Year 2020 COVID19,"{'neg': 0.0, 'neu': 1.0, 'pos': 0.0, 'compound': 0.0}",0.0,neuteral,0,[]
524,1.33932e+18,Whtrslugcaviiersong#dontstayhomeandcatchcovid19,16-12-2020 21:17,Did you know #PfizerBioNTech is #madeineu #madeineuropeanunion even if #eu27 #eu's #theeu's #europeanunion's former… https://t.co/IzBpscb1B8,Did you know PfizerBioNTech is madeineu madeineuropeanunion even if eu27 eus theeus europeanunions former,"{'neg': 0.0, 'neu': 1.0, 'pos': 0.0, 'compound': 0.0}",0.0,neuteral,0,['pfizer']
525,1.33932e+18,Eibhilin Manning,16-12-2020 21:16,Germany to start with corona vaccination on *27 December* if the vaccine is authorised already before Christmas by… https://t.co/5igtAMv8OZ,Germany to start with corona vaccination on 27 December if the vaccine is authorised already before Christmas by,"{'neg': 0.0, 'neu': 1.0, 'pos': 0.0, 'compound': 0.0}",0.0,neuteral,0,[]
526,1.33932e+18,Angelo John Gage,16-12-2020 21:09,"Imagine my pizzeria was not liable for any damages; you got a pie from me and were poisoned by it, damaging your he… https://t.co/4l2UKo97h9",Imagine my pizzeria was not liable for any damages you got a pie from me and were poisoned by it damaging your he,"{'neg': 0.331, 'neu': 0.669, 'pos': 0.0, 'compound': -0.8555}",-0.8555,negative,-1,[]
527,1.33931e+18,Higher Rock Education,16-12-2020 21:00,"#3ThingstoKnow for #Wednesday!

1⃣ 2M additional doses of the #PfizerBioNTech #CovidVaccine will be distributed nex… https://t.co/Uc2Nlpe6k6",3ThingstoKnow for Wednesday 1 2M additional doses of the PfizerBioNTech CovidVaccine will be distributed nex,"{'neg': 0.0, 'neu': 1.0, 'pos': 0.0, 'compound': 0.0}",0.0,neuteral,0,['pfizer']
528,1.33931e+18,Whtrslugcaviiersong#dontstayhomeandcatchcovid19,16-12-2020 20:57,@AvonandsomerRob Has #tonyblair appreciated  IMMENSE unDithering Of #conservatives #borisjohnson #thetories… https://t.co/sWzuazlYKD,AvonandsomerRob Has tonyblair appreciated IMMENSE unDithering Of conservatives borisjohnson thetories,"{'neg': 0.0, 'neu': 0.732, 'pos': 0.268, 'compound': 0.5106}",0.5106,positive,1,[]
529,1.33931e+18,HighlandWAG,16-12-2020 20:54,Some of you need to worry more about the chicken nuggets in your freezer than the vaccine #COVID19 #vaccine… https://t.co/nNyEIXFN43,Some of you need to worry more about the chicken nuggets in your freezer than the vaccine COVID19 vaccine,"{'neg': 0.139, 'neu': 0.861, 'pos': 0.0, 'compound': -0.4404}",-0.4404,negative,-1,[]
530,1.33931e+18,Is World News,16-12-2020 20:53,"WHO manages batch of Pfizer and Moderna vaccines for poor countries

Click to see more: https://t.co/srbIjYlU9H… https://t.co/dXTNk3EOCE",WHO manages batch of Pfizer and Moderna vaccines for poor countries Click to see more,"{'neg': 0.181, 'neu': 0.819, 'pos': 0.0, 'compound': -0.4767}",-0.4767,negative,-1,"['pfizer', 'moderna']"
531,1.33931e+18,Alicia1984,16-12-2020 20:37,Alaska healthcare worker with no history of drug allergies suffered serious 'anaphylactic-like' reaction after gett… https://t.co/aFrXqoSRhU,Alaska healthcare worker with no history of drug allergies suffered serious anaphylacticlike reaction after gett,"{'neg': 0.358, 'neu': 0.642, 'pos': 0.0, 'compound': -0.6908}",-0.6908,negative,-1,[]
532,1.33931e+18,Hussain Maqbool Ahmed,16-12-2020 20:35,@NYTHealth @devisridhar @nytimes And talented people from developing countries will be forcefully stopped/barred fo… https://t.co/vTrEAPbu9c,NYTHealth devisridhar nytimes And talented people from developing countries will be forcefully stoppedbarred fo,"{'neg': 0.0, 'neu': 0.798, 'pos': 0.202, 'compound': 0.5106}",0.5106,positive,1,[]
533,1.33931e+18,Selcuk Acar,16-12-2020 20:32,FT People of the Year: BioNTech’s Ugur Sahin and Ozlem Tureci   https://t.co/XSgXuwalF6 via @financialtimes… https://t.co/ekFBU7FfRx,FT People of the Year BioNTechs Ugur Sahin and Ozlem Tureci via financialtimes,"{'neg': 0.0, 'neu': 1.0, 'pos': 0.0, 'compound': 0.0}",0.0,neuteral,0,[]
534,1.33931e+18,The Frontiers Of,16-12-2020 20:32,Alaskan Healthcare Worker Suffers Severe Allergic Reaction To Covid-19 Vaccine #PfizerCOVIDvaccine #PfizerBioNTech… https://t.co/Kw281hAPUM,Alaskan Healthcare Worker Suffers Severe Allergic Reaction To Covid19 Vaccine PfizerCOVIDvaccine PfizerBioNTech,"{'neg': 0.467, 'neu': 0.533, 'pos': 0.0, 'compound': -0.7845}",-0.7845,negative,-1,['pfizer']
535,1.33931e+18,Whtrslugcaviiersong#dontstayhomeandcatchcovid19,16-12-2020 20:27,@10DowningStreet @CMO_England 👍 as  🌎 AWAITS  #coronavirusvaccine #COVID19vaccine  first #Pfizer #PfizerBioNTech mo… https://t.co/8AqnquyKMx,10DowningStreet CMO_England as AWAITS coronavirusvaccine COVID19vaccine first Pfizer PfizerBioNTech mo,"{'neg': 0.0, 'neu': 0.816, 'pos': 0.184, 'compound': 0.2577}",0.2577,positive,1,['pfizer']
536,1.33931e+18,Mohammad Arafat,16-12-2020 20:23,BREAKING #PfizerBioNTech #COVID19 #vaccine provokes serious allergic reaction in #USA,BREAKING PfizerBioNTech COVID19 vaccine provokes serious allergic reaction in USA,"{'neg': 0.453, 'neu': 0.547, 'pos': 0.0, 'compound': -0.5859}",-0.5859,negative,-1,['pfizer']
537,1.33931e+18,Dietsje©️,16-12-2020 20:23,"According to The New York Times, authorities are now on the alert for new allergic reactions.#PfizerBioNTech… https://t.co/XGjAdR2i6R",According to The New York Times authorities are now on the alert for new allergic reactionsPfizerBioNTech,"{'neg': 0.12, 'neu': 0.761, 'pos': 0.12, 'compound': 0.0}",0.0,neuteral,0,['pfizer']
538,1.33931e+18,Dietsje©️,16-12-2020 20:23,"Some of the test subjects did suffer from headaches and fever, among other things. In the United States, millions o… https://t.co/04KO8hBREB",Some of the test subjects did suffer from headaches and fever among other things In the United States millions o,"{'neg': 0.15, 'neu': 0.73, 'pos': 0.12, 'compound': -0.1779}",-0.1779,negative,-1,[]
539,1.3393e+18,Khaleej Times,16-12-2020 20:22,"#BREAKING #PfizerBioNTech #COVID19 #vaccine provokes serious allergic reaction in #USA
https://t.co/Hbo3mOBbuu",BREAKING PfizerBioNTech COVID19 vaccine provokes serious allergic reaction in USA,"{'neg': 0.453, 'neu': 0.547, 'pos': 0.0, 'compound': -0.5859}",-0.5859,negative,-1,['pfizer']
540,1.3393e+18,Dietsje©️,16-12-2020 20:20,The pharmaceutical company previously reported that the vaccine does not contain an egg.  The new case in America h… https://t.co/7cQdmwtrFW,The pharmaceutical company previously reported that the vaccine does not contain an egg The new case in America h,"{'neg': 0.0, 'neu': 1.0, 'pos': 0.0, 'compound': 0.0}",0.0,neuteral,0,[]
541,1.3393e+18,Dietsje©️,16-12-2020 20:19,"Both have since been restored.  They had suffered from allergies in the past, including an egg allergy.… https://t.co/5R1w4z3PFU",Both have since been restored They had suffered from allergies in the past including an egg allergy,"{'neg': 0.155, 'neu': 0.728, 'pos': 0.117, 'compound': -0.2023}",-0.2023,negative,-1,[]
542,1.3393e+18,Dietsje©️,16-12-2020 20:18,"The care worker has been admitted to hospital and is still there.  According to the newspaper, the allergic reactio… https://t.co/1Hak6uItQW",The care worker has been admitted to hospital and is still there According to the newspaper the allergic reactio,"{'neg': 0.096, 'neu': 0.702, 'pos': 0.202, 'compound': 0.34}",0.34,positive,1,[]
543,1.3393e+18,Dietsje©️,16-12-2020 20:17,"According to The New York Times, based on three anonymous sources, the health care professional had no history of a… https://t.co/KaiD7zUe7E",According to The New York Times based on three anonymous sources the health care professional had no history of a,"{'neg': 0.098, 'neu': 0.759, 'pos': 0.143, 'compound': 0.25}",0.25,positive,1,[]
544,1.3393e+18,Dietsje©️,16-12-2020 20:16,"SEVERE ALLERGIC REACTION AFTER RECEIVING  OF CORONA VACIN IN WASHINGTON  In the US state of Alaska, a health care w… https://t.co/CifPXkmzkB",SEVERE ALLERGIC REACTION AFTER RECEIVING OF CORONA VACIN IN WASHINGTON In the US state of Alaska a health care w,"{'neg': 0.256, 'neu': 0.613, 'pos': 0.131, 'compound': -0.4707}",-0.4707,negative,-1,[]
545,1.3393e+18,Jacqueline Roche,16-12-2020 20:11,"#COVID19 #COVID19USA #COVID19Vaccine #PfizerBioNTech #PfizerVaccine 
#PresidentElectJoeBiden 
#JoeBiden @JoeBiden… https://t.co/rXR216U7tV",COVID19 COVID19USA COVID19Vaccine PfizerBioNTech PfizerVaccine PresidentElectJoeBiden JoeBiden JoeBiden,"{'neg': 0.0, 'neu': 1.0, 'pos': 0.0, 'compound': 0.0}",0.0,neuteral,0,['pfizer']
546,1.3393e+18,Mujtaba Ziada,16-12-2020 20:03,"Jut took my #CovidVaccine 🕺🏽
#Vaccine #PfizerBioNTech https://t.co/KacwldqAHf",Jut took my CovidVaccine Vaccine PfizerBioNTech,"{'neg': 0.0, 'neu': 1.0, 'pos': 0.0, 'compound': 0.0}",0.0,neuteral,0,['pfizer']
